Name, Profession, Contact_Info
Mitchell Berry| PLMHP| MS,Provisionally Licensed Mental Health Counselor,13906 Gold Circle| Suite 202| Omaha| Nebraska 68144 | 4029326500x105
Heather Jackson| LIMHP| LPC| CSOTP| CCTP,Independent Mental Health Practitioner,5561 S. 48th St.| Suite 215H| Lincoln| Nebraska 68516 | (402) 975-2318
Tara Thomsen| MS| LIMHP|CPC,Licensed Independent Mental Health Professional,11060 Oak Street #2| Omaha| Nebraska 68144 | 402-933-8998
Jeannie Hughes| LIMHP,Licensed Mental Health Counselor,1299 Farnam St.| Ste 300| Omaha| Nebraska 68102 | 913-730-0789
Kevin Fleming| Ph.D.,Coach/Change Agent/Consultant,Omaha| Nebraska 68069 |
Steve Brownrigg| NCC| LADC| LIMHP,Licensed Alcohol & Drug Counselor| Licensed Independent Mental Health Practitioner,7602 Pacific St.| Suite 304| Omaha| Nebraska 68114 | 402-510-1754
Brian Hofsommer| LIMFT,Marriage and Family Therapist,9300 Underwood Avenue Ste 240| Omaha| Nebraska 68114 | 402-708-2348
Kendra Hubbard| MS,Licensed Mental Health Practitioner,5539 S 27th Street| Suite 104| Lincoln| Nebraska 68512 | 402-937-3565
Scott Panning| MA| PLMHP,Provisionally Licensed Mental Health Professional,13906 Gold Circle Suite 202| Omaha| Nebraska 68116 | 402-932-6500
